{
  "artifact_digests": {
    "evidence/ownership/ownership_registry.json": "c6d7d0442d70b9dfb7c4254cace0267fce6731ee90353cabe97069f4ab2a03fd",
    "tests/governance/test_ownership_map.py": "b0d86ba3c79b77a128d0e30459d7690581b6c5ee9cd1ac7b09ba36078bd75ed8",
    "tools/governance/ownership_map.py": "b122545b12890a3813e7c90799f8d5481c833a9ff69bbf56e0080ef8321537ea"
  },
  "created_at": "2026-09-10T14:16:26Z",
  "evidence_id": "evidence-gov-002-d498d10ed2fa",
  "git_commit": "d498d10ed2fa4168de65046944b45abfe1785efd",
  "real_boundary": false,
  "report_digest": "ce9c449f8d888957ab5a69c6624d24a5ca3f65813c9680a9aa019e6279393021",
  "report_path": "evidence/reports/report-gov-002-d498d10ed2fa.json",
  "repository_id": "https://github.com/moss101/quansiov2",
  "requirement_assertion_ids": [
    "GOV-001-A01",
    "INV-001-A01",
    "INV-006-A01"
  ],
  "requirement_ids": [
    "GOV-001",
    "INV-001",
    "INV-006"
  ],
  "rollback_verified": true,
  "schema_revision": "9.0.0",
  "status": "PASS",
  "task_assertion_ids": [
    "GOV-002-N01",
    "GOV-002-P01",
    "GOV-002-R01"
  ],
  "task_id": "GOV-002"
}
