{
  "artifact_digests": {
    "evidence/boundary/MOD-008/health-transcript.json": "9bad54434e033650cc39dc8ac4c98934946d3dc9f36c529f044246359a4ae50e",
    "evidence/boundary/MOD-008/manifest.json": "31be31481b5b075aa633ad95fd33475bc7a87761deae6555ac226faa5516cca2",
    "quansio/model_gateway/adapters.py": "75ae14598646a92fd87e913fad9540803c33217dff665af0fbd893134833b86f",
    "quansio/model_gateway/gateway.py": "cd13c0ec1064b58dea73588b69e8911f116be309fbe9b6e0384d4eb16567d06c",
    "tests/model_gateway/test_real_provider_qualification.py": "9cd49a0aecfc322c00da39f826202b03cc5ac5f132ca0b68ce8ee8efa8674702"
  },
  "created_at": "2026-09-10T09:11:05Z",
  "evidence_id": "evidence-mod-008-0aa47be3267f",
  "git_commit": "0aa47be3267f87ea7a67e0d3692f2ba2e2f27515",
  "real_boundary": true,
  "report_digest": "22e21b1d75f7c360774cb15908a9d944e6ca9578984cb178e4e8d421944bbd4e",
  "report_path": "evidence/reports/report-mod-008-0aa47be3267f.json",
  "repository_id": "https://github.com/moss101/quansiov2",
  "requirement_assertion_ids": [
    "MOD-007-A01"
  ],
  "requirement_ids": [
    "MOD-007"
  ],
  "rollback_verified": true,
  "schema_revision": "9.0.0",
  "status": "PASS",
  "task_assertion_ids": [
    "MOD-008-N01",
    "MOD-008-P01",
    "MOD-008-R01"
  ],
  "task_id": "MOD-008"
}
