{
  "artifact_digests": {
    "evidence/gates/GATE-M8.json": "484ece361cff9b5703b38799c7a5c40f96597912b82562ee558561c442426635",
    "tests/governance/test_milestone_gate.py": "e0f21e04fdf35a39a1172640eded64b9e2db076a7353479dfc8e50424d3fb03f",
    "tools/governance/milestone_gate.py": "0799f5f49ab000ef1ef2670732e87c25fd8da530bb3cfe8b91ebd233cb2a58e6"
  },
  "created_at": "2026-09-10T10:01:17Z",
  "evidence_id": "evidence-gate-m8-66810e755178",
  "git_commit": "66810e7551786991f2fb600b62198d9d3aa1a087",
  "real_boundary": false,
  "report_digest": "41999f802c1afb4bee0bb9a066969e679693279864ce59e57a0b8ba791a97e89",
  "report_path": "evidence/reports/report-gate-m8-66810e755178.json",
  "repository_id": "https://github.com/moss101/quansiov2",
  "requirement_assertion_ids": [
    "INV-008-A01"
  ],
  "requirement_ids": [
    "INV-008"
  ],
  "rollback_verified": true,
  "schema_revision": "9.0.0",
  "status": "PASS",
  "task_assertion_ids": [
    "GATE-M8-N01",
    "GATE-M8-P01",
    "GATE-M8-R01"
  ],
  "task_id": "GATE-M8"
}
