{
  "artifact_digests": {
    "evidence/boundary/QA-002/health-transcript.json": "e28a0dddeb0bdc008ef723da526c7c01fb411b0b82761f8e1b9019c4d1f18876",
    "evidence/boundary/QA-002/manifest.json": "4c05c70ad5a04daca85d57ab6e87ed541aa27663e634a5cd1fcd530f01b9857c",
    "quansio/model_gateway/gateway.py": "cd13c0ec1064b58dea73588b69e8911f116be309fbe9b6e0384d4eb16567d06c",
    "tests/qa/test_qa_verticals.py": "99ecd86ed0ab234ba813c5bdcaf412903a9a4fc9d966a527a695388d3318189d"
  },
  "created_at": "2026-09-11T03:42:36Z",
  "evidence_id": "evidence-qa-002-fb3678440fe9",
  "git_commit": "fb3678440fe9525928d3bb5b20aa0bf9752f12ce",
  "real_boundary": true,
  "report_digest": "fb40d982ed0386bb9cac58f64912ee92cd5ccdb307fae30f5fd43c79a42e2140",
  "report_path": "evidence/reports/report-qa-002-fb3678440fe9.json",
  "repository_id": "https://github.com/moss101/quansiov2",
  "requirement_assertion_ids": [
    "MOD-005-A01",
    "MOD-006-A01",
    "MOD-007-A01"
  ],
  "requirement_ids": [
    "MOD-005",
    "MOD-006",
    "MOD-007"
  ],
  "rollback_verified": true,
  "schema_revision": "9.0.0",
  "status": "PASS",
  "task_assertion_ids": [
    "QA-002-N01",
    "QA-002-P01",
    "QA-002-R01"
  ],
  "task_id": "QA-002"
}
