{
  "artifact_digests": {
    "evidence/gates/GATE-M4.json": "5776fc427befb02a4b8029094a0191f1a4b6c20fedb05bf5dca11d0f6050ae75",
    "tests/governance/test_milestone_gate.py": "c48d8950a83bb7f7d0622db08de011ed5c40ce13eb9f09de04b84ffc057202a1",
    "tools/governance/milestone_gate.py": "0799f5f49ab000ef1ef2670732e87c25fd8da530bb3cfe8b91ebd233cb2a58e6"
  },
  "created_at": "2026-09-10T08:29:49Z",
  "evidence_id": "evidence-gate-m4-d201f967b64b",
  "git_commit": "d201f967b64ba9869bf898bca6ab997e5775983c",
  "real_boundary": false,
  "report_digest": "be73fd75c4aac4b4c17f8562b6c1ca2e34cd368c3e5b7009a1ee2608947145bd",
  "report_path": "evidence/reports/report-gate-m4-d201f967b64b.json",
  "repository_id": "https://github.com/moss101/quansiov2",
  "requirement_assertion_ids": [
    "INV-008-A01"
  ],
  "requirement_ids": [
    "INV-008"
  ],
  "rollback_verified": true,
  "schema_revision": "9.0.0",
  "status": "PASS",
  "task_assertion_ids": [
    "GATE-M4-N01",
    "GATE-M4-P01",
    "GATE-M4-R01"
  ],
  "task_id": "GATE-M4"
}
