{
  "artifact_digests": {
    "evidence/boundary/EXT-001/health-transcript.json": "0fa124730a7e7aa2aaeaf4b5631a9cd3906e9eb1f0f5020402950fc98e4506a9",
    "evidence/boundary/EXT-001/manifest.json": "d1a393774e245af6d96ae0062f11e45b78aad47482886bf514d3471d3163748c",
    "migrations/up/0017_business_connectors.sql": "14faa79f61dfab13e18dcf88604c48a1416fb59529977dcded88b0ae9f81bbf9",
    "quansio/control/connectors.py": "5f61032bda7e88aba9823289b929a26f51456f586dbaead62fe4f700c5ffbb54",
    "tests/business/test_business_connectors.py": "c6a641bf94b7f68dd00587da3ca34faffa99516da3cb426f457db2addbf3db35"
  },
  "created_at": "2026-09-10T10:39:37Z",
  "evidence_id": "evidence-ext-001-1d0a6b62ea82",
  "git_commit": "1d0a6b62ea821f41a8d7ff052b8e378bb55267c0",
  "real_boundary": true,
  "report_digest": "055fa7d89069d7d5f7cca568ef15a632b2dfc21ed01e7d14f1846aa9260d393d",
  "report_path": "evidence/reports/report-ext-001-1d0a6b62ea82.json",
  "repository_id": "https://github.com/moss101/quansiov2",
  "requirement_assertion_ids": [
    "EXT-001-A01"
  ],
  "requirement_ids": [
    "EXT-001"
  ],
  "rollback_verified": true,
  "schema_revision": "9.0.0",
  "status": "PASS",
  "task_assertion_ids": [
    "EXT-001-N01",
    "EXT-001-P01",
    "EXT-001-R01"
  ],
  "task_id": "EXT-001"
}
