{
  "artifact_digests": {
    "evidence/boundary/DAT-007/health-transcript.json": "3d04dded8091d116aa9776f6f85edb401d0c2337cfa37d68ce210beba16f004c",
    "evidence/boundary/DAT-007/manifest.json": "742381f5501850dc10a399fdc0c468d7baca7f64d499f2f4dd81a7cf7d2a665d",
    "quansio/platform/cache.py": "59eb760f9c6a88580eb9c7d84d7df6ac9a0e373ce39a403b277d0012bc478335",
    "tests/runtime/test_foundation.py": "41acf6219317e7ed14b02e9ea6aaf1d9c6a9286763f814a4d4dbb980118ad01b"
  },
  "created_at": "2026-09-11T08:43:54Z",
  "evidence_id": "evidence-dat-007-46dfb1199b39",
  "git_commit": "46dfb1199b393c5eda0e5f0cd9c9bb01bba707e3",
  "real_boundary": true,
  "report_digest": "e0337973b00a2cefe7377ec3e0a813578b8bc3d71ccd99fe2da3fe2047f90819",
  "report_path": "evidence/reports/report-dat-007-46dfb1199b39.json",
  "repository_id": "https://github.com/moss101/quansiov2",
  "requirement_assertion_ids": [
    "DAT-002-A01",
    "INV-007-A01"
  ],
  "requirement_ids": [
    "DAT-002",
    "INV-007"
  ],
  "rollback_verified": true,
  "schema_revision": "9.0.0",
  "status": "PASS",
  "task_assertion_ids": [
    "DAT-007-N01",
    "DAT-007-P01",
    "DAT-007-R01"
  ],
  "task_id": "DAT-007"
}
