{
  "artifact_digests": {
    "evidence/ownership/ownership_registry.json": "44f077b1fdb47c186922ad53bb5436c0734342c778a49e0f46ef19a7bdcf0c77",
    "tests/governance/test_ownership_map.py": "b0d86ba3c79b77a128d0e30459d7690581b6c5ee9cd1ac7b09ba36078bd75ed8",
    "tools/governance/ownership_map.py": "b122545b12890a3813e7c90799f8d5481c833a9ff69bbf56e0080ef8321537ea"
  },
  "created_at": "2026-09-10T10:50:08Z",
  "evidence_id": "evidence-gov-002-86551ca4e75f",
  "git_commit": "86551ca4e75fc0049352d655ff4bec7f2166a47a",
  "real_boundary": false,
  "report_digest": "1f007e55098f7d36d4f5c4ed0782840535685c16785664b46632ba23e8617172",
  "report_path": "evidence/reports/report-gov-002-86551ca4e75f.json",
  "repository_id": "https://github.com/moss101/quansiov2",
  "requirement_assertion_ids": [
    "GOV-001-A01",
    "INV-001-A01",
    "INV-006-A01"
  ],
  "requirement_ids": [
    "GOV-001",
    "INV-001",
    "INV-006"
  ],
  "rollback_verified": true,
  "schema_revision": "9.0.0",
  "status": "PASS",
  "task_assertion_ids": [
    "GOV-002-N01",
    "GOV-002-P01",
    "GOV-002-R01"
  ],
  "task_id": "GOV-002"
}
