{
  "artifact_digests": {
    "evidence/gates/GATE-M1.json": "d4bf5a7a4a89cb2144d7770f048f3577f6e12aa14dfaef1f611635eb4f7b7a11",
    "tests/governance/test_milestone_gate.py": "0fdb64944ca0c6e69490a19e9f686cae09402af73a5227a5149d106f3181f62e",
    "tools/governance/milestone_gate.py": "0799f5f49ab000ef1ef2670732e87c25fd8da530bb3cfe8b91ebd233cb2a58e6"
  },
  "created_at": "2026-09-10T14:19:10Z",
  "evidence_id": "evidence-gate-m1-822eb9e528ab",
  "git_commit": "822eb9e528ab23c9dd9a901582188e4fe0daa337",
  "real_boundary": false,
  "report_digest": "8c4ea43c5c2a5a0bcc3183b4141f16822b007f5e78970b95364aac9315d73431",
  "report_path": "evidence/reports/report-gate-m1-822eb9e528ab.json",
  "repository_id": "https://github.com/moss101/quansiov2",
  "requirement_assertion_ids": [
    "INV-008-A01"
  ],
  "requirement_ids": [
    "INV-008"
  ],
  "rollback_verified": true,
  "schema_revision": "9.0.0",
  "status": "PASS",
  "task_assertion_ids": [
    "GATE-M1-N01",
    "GATE-M1-P01",
    "GATE-M1-R01"
  ],
  "task_id": "GATE-M1"
}
