{
  "artifact_digests": {
    "evidence/gates/GATE-M9.json": "50ce07ccc21ef4abd3ddfd97be774348eedde6e48a7e09cf8ef392e5b44021d6",
    "tests/governance/test_milestone_gate.py": "40d961004216777b2945a02aaa46763be79a54363f8dd232fcdae06f728c492b",
    "tools/governance/milestone_gate.py": "0799f5f49ab000ef1ef2670732e87c25fd8da530bb3cfe8b91ebd233cb2a58e6"
  },
  "created_at": "2026-09-11T10:10:53Z",
  "evidence_id": "evidence-gate-m9-bd8afcbb82d0",
  "git_commit": "bd8afcbb82d070e8a4d79b01fda2028b49a77907",
  "real_boundary": false,
  "report_digest": "c0b87a9df551bb2e3b43627acaaf28df6a73b4ffc50fc0e71d1e3eb68b4266a8",
  "report_path": "evidence/reports/report-gate-m9-bd8afcbb82d0.json",
  "repository_id": "https://github.com/moss101/quansiov2",
  "requirement_assertion_ids": [
    "INV-008-A01"
  ],
  "requirement_ids": [
    "INV-008"
  ],
  "rollback_verified": true,
  "schema_revision": "9.0.0",
  "status": "PASS",
  "task_assertion_ids": [
    "GATE-M9-N01",
    "GATE-M9-P01",
    "GATE-M9-R01"
  ],
  "task_id": "GATE-M9"
}
