{
  "artifact_digests": {
    "evidence/gates/GATE-M0.json": "bd20d6184a2afe8aec5543233f52b0e64752445022dddfdc00bc6937f169897e",
    "tests/governance/test_milestone_gate.py": "1945d0640a83622bda12c8520d2f193e81e892cd4aa009b3d12a9382840a5e2b",
    "tools/governance/milestone_gate.py": "0799f5f49ab000ef1ef2670732e87c25fd8da530bb3cfe8b91ebd233cb2a58e6"
  },
  "created_at": "2026-09-10T07:03:54Z",
  "evidence_id": "evidence-gate-m0-980327474f06",
  "git_commit": "980327474f0616bb14b673944049599f461ab570",
  "real_boundary": false,
  "report_digest": "4e87bdeff07a16a63db0147de9849f8affd9cab9f27506f50b98353f5fae81ff",
  "report_path": "evidence/reports/report-gate-m0-980327474f06.json",
  "repository_id": "https://github.com/moss101/quansiov2",
  "requirement_assertion_ids": [
    "INV-008-A01"
  ],
  "requirement_ids": [
    "INV-008"
  ],
  "rollback_verified": true,
  "schema_revision": "9.0.0",
  "status": "PASS",
  "task_assertion_ids": [
    "GATE-M0-N01",
    "GATE-M0-P01",
    "GATE-M0-R01"
  ],
  "task_id": "GATE-M0"
}
