{
  "artifact_digests": {
    "evidence/gates/GATE-M5.json": "34053d5a896a39049da1c901ab01cb55a303d8d7beac48068ce19e14716bbbca",
    "tests/governance/test_milestone_gate.py": "598f23dd3025bd7d851d82440b4e8d5c16ea101a777ea8df47d95ad8ec4b0ef8",
    "tools/governance/milestone_gate.py": "0799f5f49ab000ef1ef2670732e87c25fd8da530bb3cfe8b91ebd233cb2a58e6"
  },
  "created_at": "2026-09-10T07:59:53Z",
  "evidence_id": "evidence-gate-m5-3d8e1b7f23b9",
  "git_commit": "3d8e1b7f23b9e5342c2eead59945ee3a229f4809",
  "real_boundary": false,
  "report_digest": "89421b9cbada857c3716ead474e5e7c0f3e989aab7caf3159f7a27d122fd87d5",
  "report_path": "evidence/reports/report-gate-m5-3d8e1b7f23b9.json",
  "repository_id": "https://github.com/moss101/quansiov2",
  "requirement_assertion_ids": [
    "INV-008-A01"
  ],
  "requirement_ids": [
    "INV-008"
  ],
  "rollback_verified": true,
  "schema_revision": "9.0.0",
  "status": "PASS",
  "task_assertion_ids": [
    "GATE-M5-N01",
    "GATE-M5-P01",
    "GATE-M5-R01"
  ],
  "task_id": "GATE-M5"
}
