{
  "artifact_digests": {
    "evidence/gates/GATE-M5.json": "34053d5a896a39049da1c901ab01cb55a303d8d7beac48068ce19e14716bbbca",
    "tests/governance/test_milestone_gate.py": "e0f21e04fdf35a39a1172640eded64b9e2db076a7353479dfc8e50424d3fb03f",
    "tools/governance/milestone_gate.py": "0799f5f49ab000ef1ef2670732e87c25fd8da530bb3cfe8b91ebd233cb2a58e6"
  },
  "created_at": "2026-09-10T11:06:03Z",
  "evidence_id": "evidence-gate-m5-58c02b4651f0",
  "git_commit": "58c02b4651f0fd767f4bb74fb69e41e3ccdd89c3",
  "real_boundary": false,
  "report_digest": "21ea57a82cab784893e60130e123615b813eb39a2f6d77a724e31a6831d76015",
  "report_path": "evidence/reports/report-gate-m5-58c02b4651f0.json",
  "repository_id": "https://github.com/moss101/quansiov2",
  "requirement_assertion_ids": [
    "INV-008-A01"
  ],
  "requirement_ids": [
    "INV-008"
  ],
  "rollback_verified": true,
  "schema_revision": "9.0.0",
  "status": "PASS",
  "task_assertion_ids": [
    "GATE-M5-N01",
    "GATE-M5-P01",
    "GATE-M5-R01"
  ],
  "task_id": "GATE-M5"
}
