{
  "artifact_digests": {
    "evidence/gates/GATE-M2.json": "9887b909f49860d262485e7a3d070b2b75cc4476f192711d09313af976f277ac",
    "tests/governance/test_milestone_gate.py": "e91a702d379800b3571e4829417095cc7a10e669ff505dd388610a24a41961a7",
    "tools/governance/milestone_gate.py": "0799f5f49ab000ef1ef2670732e87c25fd8da530bb3cfe8b91ebd233cb2a58e6"
  },
  "created_at": "2026-09-10T17:37:01Z",
  "evidence_id": "evidence-gate-m2-bc33fa692505",
  "git_commit": "bc33fa6925051f1289bf14ce8ee37e437070084d",
  "real_boundary": false,
  "report_digest": "10e150a15ef5b57e12c330e1cbd78819367a95c5533ca1e79b03400bac1b78cc",
  "report_path": "evidence/reports/report-gate-m2-bc33fa692505.json",
  "repository_id": "https://github.com/moss101/quansiov2",
  "requirement_assertion_ids": [
    "INV-008-A01"
  ],
  "requirement_ids": [
    "INV-008"
  ],
  "rollback_verified": true,
  "schema_revision": "9.0.0",
  "status": "PASS",
  "task_assertion_ids": [
    "GATE-M2-N01",
    "GATE-M2-P01",
    "GATE-M2-R01"
  ],
  "task_id": "GATE-M2"
}
