{
  "artifact_digests": {
    "evidence/gates/GATE-M1.json": "d4bf5a7a4a89cb2144d7770f048f3577f6e12aa14dfaef1f611635eb4f7b7a11",
    "tests/governance/test_milestone_gate.py": "1945d0640a83622bda12c8520d2f193e81e892cd4aa009b3d12a9382840a5e2b",
    "tools/governance/milestone_gate.py": "0799f5f49ab000ef1ef2670732e87c25fd8da530bb3cfe8b91ebd233cb2a58e6"
  },
  "created_at": "2026-09-10T07:01:34Z",
  "evidence_id": "evidence-gate-m1-ad453f23bb05",
  "git_commit": "ad453f23bb052f40a36362ccf35507a1076957f9",
  "real_boundary": false,
  "report_digest": "129fd11ac43467b972d53c63d1c47b80b752c8b01108ded2ec53a3bf977ba146",
  "report_path": "evidence/reports/report-gate-m1-ad453f23bb05.json",
  "repository_id": "https://github.com/moss101/quansiov2",
  "requirement_assertion_ids": [
    "INV-008-A01"
  ],
  "requirement_ids": [
    "INV-008"
  ],
  "rollback_verified": true,
  "schema_revision": "9.0.0",
  "status": "PASS",
  "task_assertion_ids": [
    "GATE-M1-N01",
    "GATE-M1-P01",
    "GATE-M1-R01"
  ],
  "task_id": "GATE-M1"
}
