{
  "artifact_digests": {
    "evidence/gates/GATE-M8.json": "c2fd67329a7168187c4cfeb149a058f55780ec7d5dcd77db6d0d748d01b2eccd",
    "tests/governance/test_milestone_gate.py": "40d961004216777b2945a02aaa46763be79a54363f8dd232fcdae06f728c492b",
    "tools/governance/milestone_gate.py": "0799f5f49ab000ef1ef2670732e87c25fd8da530bb3cfe8b91ebd233cb2a58e6"
  },
  "created_at": "2026-09-11T04:19:55Z",
  "evidence_id": "evidence-gate-m8-d9f72b9ee42d",
  "git_commit": "d9f72b9ee42d6847fd534828397509aa6804ccba",
  "real_boundary": false,
  "report_digest": "fe73fa26a616bd5d2f6251103fc46631f992d6d0e0cfb0ec83c5662b4f2422a4",
  "report_path": "evidence/reports/report-gate-m8-d9f72b9ee42d.json",
  "repository_id": "https://github.com/moss101/quansiov2",
  "requirement_assertion_ids": [
    "INV-008-A01"
  ],
  "requirement_ids": [
    "INV-008"
  ],
  "rollback_verified": true,
  "schema_revision": "9.0.0",
  "status": "PASS",
  "task_assertion_ids": [
    "GATE-M8-N01",
    "GATE-M8-P01",
    "GATE-M8-R01"
  ],
  "task_id": "GATE-M8"
}
