{
  "artifact_digests": {
    "evidence/boundary/RUN-006/health-transcript.json": "3d04dded8091d116aa9776f6f85edb401d0c2337cfa37d68ce210beba16f004c",
    "evidence/boundary/RUN-006/manifest.json": "742381f5501850dc10a399fdc0c468d7baca7f64d499f2f4dd81a7cf7d2a665d",
    "migrations/up/0010_effects_guard.sql": "bd919b04cfa1b68b56c0e8cc5d0cd19754486023ca6bc5bfff4895e04b38049c",
    "quansio/runtime/orchestration.py": "a973c4f5e1f56b0ad3c0b6c81544a83f967adf2c3ed935a8fa9d291d9be3d40b",
    "tests/runtime/test_orchestration.py": "1f880f67d284631ddab071a285396246e6951aeb135278bee0c4c1322c65bc0b"
  },
  "created_at": "2026-09-11T08:44:02Z",
  "evidence_id": "evidence-run-006-46dfb1199b39",
  "git_commit": "46dfb1199b393c5eda0e5f0cd9c9bb01bba707e3",
  "real_boundary": true,
  "report_digest": "7da4a4ca4d0294fe24ace313fdc42c57b7c33bee2d8650a7be3aa876669e50ac",
  "report_path": "evidence/reports/report-run-006-46dfb1199b39.json",
  "repository_id": "https://github.com/moss101/quansiov2",
  "requirement_assertion_ids": [
    "EFF-004-A01",
    "RUN-005-A01"
  ],
  "requirement_ids": [
    "EFF-004",
    "RUN-005"
  ],
  "rollback_verified": true,
  "schema_revision": "9.0.0",
  "status": "PASS",
  "task_assertion_ids": [
    "RUN-006-N01",
    "RUN-006-P01",
    "RUN-006-R01"
  ],
  "task_id": "RUN-006"
}
