{
  "artifact_digests": {
    "evidence/gates/GATE-M3.json": "a59376a0f5e20cd2d447158f2fc2e43edeb593441105d60760601e19af26d9dd",
    "tests/governance/test_milestone_gate.py": "73b4da812b82ec63787e395233f5368a76680bbb52ef4831ab3d1ad1d8d05aaa",
    "tools/governance/milestone_gate.py": "0799f5f49ab000ef1ef2670732e87c25fd8da530bb3cfe8b91ebd233cb2a58e6"
  },
  "created_at": "2026-09-10T07:36:22Z",
  "evidence_id": "evidence-gate-m3-801c9e733b41",
  "git_commit": "801c9e733b41d0652e7308df45ce95946568e0b4",
  "real_boundary": false,
  "report_digest": "5144f40023caedb71d0b1bb2c275a3625da4659cf3646e2e61d67d5f31b5aad3",
  "report_path": "evidence/reports/report-gate-m3-801c9e733b41.json",
  "repository_id": "https://github.com/moss101/quansiov2",
  "requirement_assertion_ids": [
    "INV-008-A01"
  ],
  "requirement_ids": [
    "INV-008"
  ],
  "rollback_verified": true,
  "schema_revision": "9.0.0",
  "status": "PASS",
  "task_assertion_ids": [
    "GATE-M3-N01",
    "GATE-M3-P01",
    "GATE-M3-R01"
  ],
  "task_id": "GATE-M3"
}
