{
  "artifact_digests": {
    "evidence/boundary/MOD-008/health-transcript.json": "8536038a3841c78b8876e1e8e545e9a1b718ca61460cb16c18a6c7445e8c4e4a",
    "evidence/boundary/MOD-008/manifest.json": "7e12434570c11a5db6111653290e90bf373a95cab7b81407c447c864cabf8ea5",
    "quansio/model_gateway/adapters.py": "75ae14598646a92fd87e913fad9540803c33217dff665af0fbd893134833b86f",
    "quansio/model_gateway/gateway.py": "cd13c0ec1064b58dea73588b69e8911f116be309fbe9b6e0384d4eb16567d06c",
    "tests/model_gateway/test_real_provider_qualification.py": "9cd49a0aecfc322c00da39f826202b03cc5ac5f132ca0b68ce8ee8efa8674702"
  },
  "created_at": "2026-09-10T14:14:59Z",
  "evidence_id": "evidence-mod-008-3d68ef538aa7",
  "git_commit": "3d68ef538aa757da29946ae5770f58346cbd69f0",
  "real_boundary": true,
  "report_digest": "cfe2d9db915cad6c87c903c65bcdbe8906da1ba08de7a82a2a48cf4b8fe6e00b",
  "report_path": "evidence/reports/report-mod-008-3d68ef538aa7.json",
  "repository_id": "https://github.com/moss101/quansiov2",
  "requirement_assertion_ids": [
    "MOD-007-A01"
  ],
  "requirement_ids": [
    "MOD-007"
  ],
  "rollback_verified": true,
  "schema_revision": "9.0.0",
  "status": "PASS",
  "task_assertion_ids": [
    "MOD-008-N01",
    "MOD-008-P01",
    "MOD-008-R01"
  ],
  "task_id": "MOD-008"
}
